{
    "$schema": "./template.schema.json",
    "source": "",
    "cake": {
        "version": "",
        "target": "netstandard1.6;net46",
        "frosting": {
            "context": "",
            "lifetime": "",
            "tasks": [
                
            ]
        },
        "scriptFileName": ""
    },
    "project": {
        "name": "",
        "target": ""
    },
    "test": {
        "xunit_version": "",
        "target": ""
    }
}